{
  "version": "v1",
  "snapshot": "contracts/collector/unified/examples/unified_구두_top20_20260803_002024.json",
  "reviewStatus": "DRAFT",
  "humanReviewRequired": true,
  "cases": [
    {"id":"exact-001","type":"exact","question":"이브 웨지 3 찾아줘","required":[{"field":"productType","value":"이브 웨지 3"}],"preferred":[],"judgments":[{"merchant":"abcmart","externalId":"1010110646","relevance":3,"evidenceFields":["title"]}],"expectNoResults":false,"requiresVerification":false,"allowedRelaxations":[]},
    {"id":"exact-002","type":"exact","question":"누오보 픽시스 4 240","required":[{"field":"brand","value":"누오보"},{"field":"productType","value":"픽시스 4"},{"field":"size","value":"240"}],"preferred":[],"judgments":[{"merchant":"abcmart","externalId":"1010103543","relevance":3,"evidenceFields":["brand","title","options.sizes"]}],"expectNoResults":false,"requiresVerification":false,"allowedRelaxations":[]},
    {"id":"exact-003","type":"exact","question":"스테파노로시 빈슨 42","required":[{"field":"brand","value":"스테파노로시"},{"field":"productType","value":"빈슨"},{"field":"size","value":"42"}],"preferred":[],"judgments":[{"merchant":"abcmart","externalId":"1010103856","relevance":3,"evidenceFields":["brand","title","options.sizes"]}],"expectNoResults":false,"requiresVerification":false,"allowedRelaxations":[]},
    {"id":"exact-004","type":"exact","question":"젤 메리제인 1 화이트 240","required":[{"field":"productType","value":"젤 메리제인 1"},{"field":"color","value":"WHITE"},{"field":"size","value":"240"}],"preferred":[],"judgments":[{"merchant":"abcmart","externalId":"1010124720","relevance":3,"evidenceFields":["title","options.colors","options.sizes"]}],"expectNoResults":false,"requiresVerification":false,"allowedRelaxations":[]},
    {"id":"exact-005","type":"exact","question":"불러스 1 베이지 245","required":[{"field":"productType","value":"불러스 1"},{"field":"color","value":"BEIGE"},{"field":"size","value":"245"}],"preferred":[],"judgments":[{"merchant":"abcmart","externalId":"1010102872","relevance":3,"evidenceFields":["title","options.colors","options.sizes"]}],"expectNoResults":false,"requiresVerification":false,"allowedRelaxations":[]},
    {"id":"exact-006","type":"exact","question":"탈리타 5 블랙 250","required":[{"field":"productType","value":"탈리타 5"},{"field":"color","value":"BLACK"},{"field":"size","value":"250"}],"preferred":[],"judgments":[{"merchant":"abcmart","externalId":"1010103255","relevance":3,"evidenceFields":["title","options.colors","options.sizes"]}],"expectNoResults":false,"requiresVerification":false,"allowedRelaxations":[]},
    {"id":"exact-007","type":"exact","question":"이브 스트랩 펌프스 3 235","required":[{"field":"productType","value":"이브 스트랩 펌프스 3"},{"field":"size","value":"235"}],"preferred":[],"judgments":[{"merchant":"abcmart","externalId":"1010110648","relevance":3,"evidenceFields":["title","options.sizes"]}],"expectNoResults":false,"requiresVerification":false,"allowedRelaxations":[]},
    {"id":"exact-008","type":"exact","question":"젤 플랫 1 블랙 230","required":[{"field":"productType","value":"젤 플랫 1"},{"field":"color","value":"BLACK"},{"field":"size","value":"230"}],"preferred":[],"judgments":[{"merchant":"abcmart","externalId":"1010124721","relevance":3,"evidenceFields":["title","options.colors","options.sizes"]}],"expectNoResults":false,"requiresVerification":false,"allowedRelaxations":[]},
    {"id":"exact-009","type":"exact","question":"호킨스 마이크로 라이트 로퍼 브라운 265","required":[{"field":"brand","value":"호킨스"},{"field":"productType","value":"마이크로 라이트 로퍼"},{"field":"color","value":"BROWN"},{"field":"size","value":"265"}],"preferred":[],"judgments":[{"merchant":"abcmart","externalId":"1010093845","relevance":3,"evidenceFields":["brand","title","options.colors","options.sizes"]}],"expectNoResults":false,"requiresVerification":false,"allowedRelaxations":[]},
    {"id":"exact-010","type":"exact","question":"젤 플랫 1 실버 245","required":[{"field":"productType","value":"젤 플랫 1"},{"field":"color","value":"SILVER"},{"field":"size","value":"245"}],"preferred":[],"judgments":[{"merchant":"abcmart","externalId":"1010124722","relevance":3,"evidenceFields":["title","options.colors","options.sizes"]}],"expectNoResults":false,"requiresVerification":false,"allowedRelaxations":[]},
    {"id":"exact-011","type":"exact","question":"기호 BELLA SLINGBACK BLACK 240","required":[{"field":"brand","value":"기호"},{"field":"productType","value":"BELLA SLINGBACK"},{"field":"color","value":"BLACK"},{"field":"size","value":"240"}],"preferred":[],"judgments":[{"merchant":"29cm","externalId":"2468262","relevance":3,"evidenceFields":["brand","title","options.colors","options.sizes"]}],"expectNoResults":false,"requiresVerification":false,"allowedRelaxations":[]},
    {"id":"exact-012","type":"exact","question":"포른른 Strap Stiletto Heel Slingback 240","required":[{"field":"brand","value":"포른른"},{"field":"productType","value":"Strap Stiletto Heel Slingback"},{"field":"size","value":"240"}],"preferred":[],"judgments":[{"merchant":"29cm","externalId":"3236312","relevance":3,"evidenceFields":["brand","title","options.sizes"]}],"expectNoResults":false,"requiresVerification":false,"allowedRelaxations":[]},
    {"id":"exact-013","type":"exact","question":"타크트로이메 Ring 리본 새틴 펌프스","required":[{"field":"brand","value":"타크트로이메"},{"field":"productType","value":"Ring 리본 새틴 포인티드 토 펌프스"}],"preferred":[],"judgments":[{"merchant":"29cm","externalId":"3069582","relevance":3,"evidenceFields":["brand","title"]}],"expectNoResults":false,"requiresVerification":false,"allowedRelaxations":[]},
    {"id":"exact-014","type":"exact","question":"사뿐 아린스 베이직 슬링백 255","required":[{"field":"brand","value":"사뿐"},{"field":"productType","value":"아린스 베이직 슬링백"},{"field":"size","value":"255"}],"preferred":[],"judgments":[{"merchant":"29cm","externalId":"2748804","relevance":3,"evidenceFields":["brand","title","options.sizes"]}],"expectNoResults":false,"requiresVerification":false,"allowedRelaxations":[]},
    {"id":"exact-015","type":"exact","question":"스토 Ciel Jelly Kitten heel","required":[{"field":"brand","value":"스토"},{"field":"productType","value":"Ciel Jelly Kitten heel"}],"preferred":[],"judgments":[{"merchant":"29cm","externalId":"3959973","relevance":3,"evidenceFields":["brand","title"]}],"expectNoResults":false,"requiresVerification":false,"allowedRelaxations":[]},

    {"id":"semantic-001","type":"semantic","question":"면접용 갈색 구두 265 10만 원 이하","required":[{"field":"productType","value":"구두"},{"field":"size","value":"265"},{"field":"priceMax","value":"100000"}],"preferred":[{"field":"usage","value":"면접"},{"field":"color","value":"brown"}],"judgments":[{"merchant":"abcmart","externalId":"1010093845","relevance":3,"evidenceFields":["category_path","options.colors","options.sizes","price"]}],"expectNoResults":false,"requiresVerification":false,"allowedRelaxations":["usage"]},
    {"id":"semantic-002","type":"semantic","question":"사무실에서 편하게 신을 베이지 로퍼 245","required":[{"field":"productType","value":"로퍼"},{"field":"size","value":"245"}],"preferred":[{"field":"usage","value":"사무실"},{"field":"color","value":"BEIGE"},{"field":"reviewSignal","value":"편안함"}],"judgments":[{"merchant":"abcmart","externalId":"1010102872","relevance":3,"evidenceFields":["category_path","options.colors","options.sizes","reviews"]},{"merchant":"abcmart","externalId":"1010103543","relevance":1,"evidenceFields":["options.colors","options.sizes","reviews"]}],"expectNoResults":false,"requiresVerification":false,"allowedRelaxations":["productType"]},
    {"id":"semantic-003","type":"semantic","question":"하객룩에 어울리는 검정 슬링백 240","required":[{"field":"productType","value":"슬링백"},{"field":"size","value":"240"}],"preferred":[{"field":"usage","value":"하객"},{"field":"color","value":"BLACK"}],"judgments":[{"merchant":"29cm","externalId":"2468262","relevance":3,"evidenceFields":["title","options.colors","options.sizes"]},{"merchant":"29cm","externalId":"2748804","relevance":2,"evidenceFields":["title","options.colors","options.sizes"]},{"merchant":"29cm","externalId":"3236312","relevance":2,"evidenceFields":["title","options.sizes"]}],"expectNoResults":false,"requiresVerification":false,"allowedRelaxations":["color"]},
    {"id":"semantic-004","type":"semantic","question":"발볼 넓은 사람이 편하게 신었다는 245 신발","required":[{"field":"size","value":"245"}],"preferred":[{"field":"reviewSignal","value":"발볼 넓음"},{"field":"reviewSignal","value":"편안함"}],"judgments":[{"merchant":"abcmart","externalId":"1010103543","relevance":3,"evidenceFields":["options.sizes","reviews"]}],"expectNoResults":false,"requiresVerification":false,"allowedRelaxations":[]},
    {"id":"semantic-005","type":"semantic","question":"굽 낮은 기본 검정 구두 230","required":[{"field":"productType","value":"구두"},{"field":"size","value":"230"}],"preferred":[{"field":"color","value":"BLACK"},{"field":"usage","value":"기본템"}],"judgments":[{"merchant":"abcmart","externalId":"1010110646","relevance":3,"evidenceFields":["category_path","options.colors","options.sizes","reviews"]},{"merchant":"abcmart","externalId":"1010124721","relevance":2,"evidenceFields":["category_path","options.colors","options.sizes"]}],"expectNoResults":false,"requiresVerification":false,"allowedRelaxations":["usage"]},
    {"id":"semantic-006","type":"semantic","question":"봄부터 가을까지 신을 베이지 245 메리제인","required":[{"field":"productType","value":"메리제인"},{"field":"size","value":"245"}],"preferred":[{"field":"color","value":"BEIGE"},{"field":"usage","value":"봄 가을"}],"judgments":[{"merchant":"abcmart","externalId":"1010103543","relevance":3,"evidenceFields":["category_path","options.colors","options.sizes","reviews"]}],"expectNoResults":false,"requiresVerification":false,"allowedRelaxations":[]},